{"schema_version":1,"comic_git_engine_version":"1.1.0","comic":{"id":"main","name":"Explicit URL Override Fixture"},"scheduled_post_count":0,"pages":[{"id":"main/001","page_name":"001","url":"/explicit-url-overrides/comic/001/","title":"Override URL Page","post_date":"2025-08-01","thumbnail_url":null,"storyline":"","characters":[],"tags":["url-overrides"],"transcript_languages":[],"images":[{"filename":"Override Page.png","url":"/explicit-url-overrides/your_content/comics/001/Override Page.png","title":"Override URL Page","alt_text":"A single-page fixture for explicit URL overrides.","thumbnail_url":null}],"extra":{}}]}